

 Parallel Execution: Process Information
 ==============================================================================
 Rank   Node Name                              NodeID   MyNodeRank  NodeMaster
    0   u-0-11.local                              0          0          0
    1   u-0-11.local                              1          0          1
    2   u-0-11.local                              2          0          2
    3   u-0-11.local                              3          0          3
 ==============================================================================


May use up to 31200MB of RAM as shared memory on node 0
May use up to 31250MB of RAM as shared memory on node 1
May use up to 31250MB of RAM as shared memory on node 3
May use up to 31250MB of RAM as shared memory on node 2

 *******************************************************************************
 *                                                                             *
 *  --------------------------------                                           *
 *   Amsterdam Modeling Suite (AMS)              2025.104                      *
 *  --------------------------------                                           *
 *                                               r250815 2025-08-15 94ea0506   *
 *                                                                             *
 *                                                                             *
 *                              =================                              *
 *                              |               |                              *
 *                              |     A M S     |                              *
 *                              |               |                              *
 *                              =================                              *
 *                                                                             *
 *                                                                             *
 *   Online information and documentation:  https://www.scm.com/support/       *
 *   E-mail:  support@scm.com   info@scm.com                                   *
 *                                                                             *
 *   Scientific publications using AMS results must be properly referenced     *
 *   See the User Manuals (or the web site) for recommended citations          *
 *   The terms and conditions of the End User License Agreement apply to       *
 *   the use of AMS, https://www.scm.com/license-terms/                        *
 *                                                                             *
 **********************  x86_64_linux_intel / intelmpi  ************************
 
 Licensed to: Dr. Val?rie Vallet / Laboratoire PhLAM UMR 8523 / Villeneuve d'Ascq Cedex / FRANCE 2024-12-20 16:14:47
 SCM User ID: u10325
  
 AMS 2025.104  RunTime: Nov13-2025 11:52:05  ShM Nodes: 4  Procs: 4

 AMS jobname: H2O.pbe0-d3bj-gp.x2c-sr
 AMS jobid  : 2024227525

 Start   directory: /state/partition2/vallet/1073344.phlam-s-sakura/
 Results directory: /home/vallet/ANL/ANL-UVI-structures-Emily/H2O/X2C-SO/H2O.pbe0-d3bj-gp.x2c-sr.results/
 Scratch directory: /state/partition2/vallet/1073344.phlam-s-sakura/amstmp_H2O.pbe0-d3bj-gp.x2c-sr_kid0.2024227525/


 Communication costs MPI_COMM_WORLD:      8.716 usec per message,   0.0586 usec per 8-byte item
 Communication costs for intra-node:      0.147 usec per message,   0.0005 usec per 8-byte item

 RNG seed: -273155837 1978863136 1667279590 177792128 -2079301059 -1403324837 -791037732 -531829986



                      ************************************************************************
                      *  ADF 2025.104  RunTime: Nov13-2025 11:52:09  ShM Nodes: 4  Procs: 4  *
                      ************************************************************************
  

       ****************************
       * SINGLE POINT CALCULATION *
       ****************************
 
--------
Geometry
--------
Formula: H2O
Atoms
  Index Symbol   x (angstrom)   y (angstrom)   z (angstrom)
      1      O    -0.00000000     0.27222200     0.00000000
      2      H     0.00000000     0.86388900     0.75913900
      3      H    -0.00000000     0.86388900    -0.75913900
 
Total System Charge             0.00000
Bonding info available!
 
 
----------------
ADF Engine Input
----------------
 
 Basis
 Type TZ2P
 Core None
 End
 XC
 Hybrid PBE0
 DISPERSION Grimme3 BJDAMP
 End
 Relativity
 Formalism X2C
 End
 NumericalQuality Good
 

 Title: *** (NO TITLE) ***

 *** adf ***



 ===========================
 A T T A C H E D   F I L E S
 ===========================
  



 ===============================
 M O D E L   P A R A M E T E R S
 ===============================
  
 DENSITY FUNCTIONAL POTENTIAL (scf)
    Hybrid:                            PBE0                                    == Not Default ==

 SPIN  (restricted / unrestr.)
    Molecule:                          Restricted                               
    Fragments:                         Restricted                               

 OTHER ASPECTS
    Relativistic Corrections:          scalar (X2C,MAPA)                       == Not Default ==

    Nuclear Charge Density Model:      Point Charge Nuclei                      
    Core Treatment:                    Frozen Orbital(s)                        

    Hyperfine or Zeeman Interaction:   ---                                      

 Settings for Grimme D3 dispersion correction

      damping                        BJ
      s6                          1.000
      s8                          1.218
      a1                          0.414
      a2                          4.859

 Other (technical) parameters

      alpha                      14.000
      version                         4
 
 WARNING: Atom coordinates do not satisfy full symmetry (probably due to orientation).


 Fragment File(s)
 ----------------
 O:
         file : /home/vallet/ANL/ANL-UVI-structures-Emily/H2O/X2C-SO/H2O.pbe0-d3bj-gp.x2c-sr.results/t21.6F99AD97.O
         jobid: 0
         title: Oxygen (TZ2P)
 H:
         file : /home/vallet/ANL/ANL-UVI-structures-Emily/H2O/X2C-SO/H2O.pbe0-d3bj-gp.x2c-sr.results/t21.FC7E34C.H
         jobid: 0
         title: Hydrogen (TZ2P)



 ===============
 G E O M E T R Y  ***  Planar Molecule  ***
 ===============
  

 ATOMS
 =====                            X Y Z                    CHARGE
                                (Angstrom)             Nucl     +Core       At.Mass
                       --------------------------    ----------------       -------
    1  O               0.0000    0.2722    0.0000      8.00      8.00       15.9949
    2  H               0.0000    0.8639    0.7591      1.00      1.00        1.0078
    3  H               0.0000    0.8639   -0.7591      1.00      1.00        1.0078


 FRAGMENTS
 =========                                     Atoms in this Fragment     Cart. coord.s (Angstrom)
                                               -------------------------------------------------------
    1  O                                                 1  O            0.0000    0.2722    0.0000
    2  H                                                 2  H            0.0000    0.8639    0.7591
    3  H                                                 3  H            0.0000    0.8639   -0.7591


 Interatomic Distance Matrix (Angstrom)
 --------------------------------------

   1)     0.000
   2)     0.962   0.000
   3)     0.962   1.518   0.000

 Min. Distance =    0.9625
 Max. Distance =    1.5183



 =====================================
 S Y M M E T R Y ,   E L E C T R O N S
 =====================================
  
 Symmetry: NOSYM

 Irreducible Representations, including subspecies
 -------------------------------------------------
 A

 Symmetry is NOT used when fitting density


 Configuration of Valence Electrons
 ==================================
 ( determined in the SCF procedure )

 Total:   10

 Net Charge: 0 (Nuclei minus Electrons)

 Aufbau principle for MO occupations will be applied through SCF cycle no.     150
 Thereafter, the program will assign electrons to MOs that are spatially
 similar to the occupied MOs in a "reference" cycle ("KeepOrbitals").
 The reference cycle is always the PREVIOUS cycle: it will evolve with
 the SCF procedure.
 ***************************************************************************************************



                                      ****************************************
                                      *  B U I L D : (Fragments, Functions)  *
                                      ****************************************
  



 =======
 S F O s  ***  (Symmetrized Fragment Orbitals)  ***
 =======
  
 SFOs are linear combinations of (valence) Fragment Orbitals (FOs), such that the SFOs transform as the
 irreducible representations of the (molecular) symmetry group. Each SFO is therefore characterized by
 an irrep of the molecule and by a few (or only one) generating FOs.
 The SFOs constitute a symmetry-adapted basis for the Fock matrix. The MO eigenvector coefficients in
 this basis provide a direct interpretation of the MOs in terms of Frontier Orbital Theory.

 The SFOs are combined with auxiliary Core Functions (CFs) to ensure orthogonalization on the (frozen)
 Core Orbitals (COs). The Core-orthogonalized SFOs (CSFOs) constitute the true Fock basis.

 The FOs, and hence also the (C)SFOs are combinations of the elementary basis functions (BAS). The basis
 functions that participate in the description of the SFOs depend on the irrep. The indices of the
 involved functions are printed below for each irrep.
 (The complete list of primitive basis functions is printed in another section)

 Total nr. of (C)SFOs (summation over all irreps) :    48

 NOTE: a (C)SFO that is defined as a combination of more than one FO is usually NOT normalized.



                                       === A ===
 Nr. of SFOs :   48
 Cartesian basis functions that participate in this irrep (total number =    54) :
      1     2     3     4     5     6     9    12     7    10
     13     8    11    14    15    16    17    18    19    20
     21    22    23    24    25    26    27    28    29    30
     31    32    33    34    35    36    37    38    39    40
     41    42    43    44    45    46    47    48    49    50
     51    52    53    54

    SFO  (index         Fragment          Generating    Expansion in Fragment Orbitals
  indx  incl.CFs)   Occup   Orb.Energy   FragmentType  Coeff.   Orbital     on Fragment
 --------------------------------------------------------------------------------------
     1       1      2.000     -19.396 au  O             1.00      1 S               1
                        (    -527.798 eV)
     2       2      2.000      -0.999 au  O             1.00      2 S               1
                        (     -27.197 eV)
     3       3       --         0.856 au  O             1.00      3 S               1
                        (      23.286 eV)
     4       4       --        13.669 au  O             1.00      4 S               1
                        (     371.959 eV)
     5       5       --       122.371 au  O             1.00      5 S               1
                        (    3329.873 eV)
     6       6      1.333      -0.366 au  O             1.00      1 P:x             1
                        (      -9.955 eV)
     7       7       --         0.397 au  O             1.00      2 P:x             1
                        (      10.811 eV)
     8       8       --         3.979 au  O             1.00      3 P:x             1
                        (     108.279 eV)
     9       9      1.333      -0.366 au  O             1.00      1 P:y             1
                        (      -9.955 eV)
    10      10       --         0.397 au  O             1.00      2 P:y             1
                        (      10.811 eV)
    11      11       --         3.979 au  O             1.00      3 P:y             1
                        (     108.279 eV)
    12      12      1.333      -0.366 au  O             1.00      1 P:z             1
                        (      -9.955 eV)
    13      13       --         0.397 au  O             1.00      2 P:z             1
                        (      10.811 eV)
    14      14       --         3.979 au  O             1.00      3 P:z             1
                        (     108.279 eV)
    15      15       --         1.128 au  O             1.00      1 D:z2            1
                        (      30.706 eV)
    16      16       --         1.128 au  O             1.00      1 D:x2-y2         1
                        (      30.706 eV)
    17      17       --         1.128 au  O             1.00      1 D:xy            1
                        (      30.706 eV)
    18      18       --         1.128 au  O             1.00      1 D:xz            1
                        (      30.706 eV)
    19      19       --         1.128 au  O             1.00      1 D:yz            1
                        (      30.706 eV)
    20      20       --         3.446 au  O             1.00      1 F:z3            1
                        (      93.772 eV)
    21      21       --         3.446 au  O             1.00      1 F:z             1
                        (      93.772 eV)
    22      22       --         3.446 au  O             1.00      1 F:xyz           1
                        (      93.772 eV)
    23      23       --         3.446 au  O             1.00      1 F:z2x           1
                        (      93.772 eV)
    24      24       --         3.446 au  O             1.00      1 F:z2y           1
                        (      93.772 eV)
    25      25       --         3.446 au  O             1.00      1 F:x             1
                        (      93.772 eV)
    26      26       --         3.446 au  O             1.00      1 F:y             1
                        (      93.772 eV)
    27      27      1.000      -0.242 au  H             1.00      1 S               2
                        (      -6.582 eV)
    28      28       --         0.113 au  H             1.00      2 S               2
                        (       3.073 eV)
    29      29       --         1.599 au  H             1.00      3 S               2
                        (      43.500 eV)
    30      30       --         0.445 au  H             1.00      1 P:x             2
                        (      12.103 eV)
    31      31       --         0.445 au  H             1.00      1 P:y             2
                        (      12.103 eV)
    32      32       --         0.445 au  H             1.00      1 P:z             2
                        (      12.103 eV)
    33      33       --         2.628 au  H             1.00      1 D:z2            2
                        (      71.505 eV)
    34      34       --         2.628 au  H             1.00      1 D:x2-y2         2
                        (      71.505 eV)
    35      35       --         2.628 au  H             1.00      1 D:xy            2
                        (      71.505 eV)
    36      36       --         2.628 au  H             1.00      1 D:xz            2
                        (      71.505 eV)
    37      37       --         2.628 au  H             1.00      1 D:yz            2
                        (      71.505 eV)
    38      38      1.000      -0.242 au  H             1.00      1 S               3
                        (      -6.582 eV)
    39      39       --         0.113 au  H             1.00      2 S               3
                        (       3.073 eV)
    40      40       --         1.599 au  H             1.00      3 S               3
                        (      43.500 eV)
    41      41       --         0.445 au  H             1.00      1 P:x             3
                        (      12.103 eV)
    42      42       --         0.445 au  H             1.00      1 P:y             3
                        (      12.103 eV)
    43      43       --         0.445 au  H             1.00      1 P:z             3
                        (      12.103 eV)
    44      44       --         2.628 au  H             1.00      1 D:z2            3
                        (      71.505 eV)
    45      45       --         2.628 au  H             1.00      1 D:x2-y2         3
                        (      71.505 eV)
    46      46       --         2.628 au  H             1.00      1 D:xy            3
                        (      71.505 eV)
    47      47       --         2.628 au  H             1.00      1 D:xz            3
                        (      71.505 eV)
    48      48       --         2.628 au  H             1.00      1 D:yz            3
                        (      71.505 eV)



 ================================
 (Slater-type)  F U N C T I O N S  ***  (Basis and Fit)  ***
 ================================
  

 Atom Type    1  (O)
 ==============

 Valence Basis Sets:  10
 -----------------------
   1 S    9.800000
   1 S    6.800000
   2 S    7.580000
   2 S    2.880000
   2 S    1.720000
   2 P    4.080000
   2 P    2.080000
   2 P    1.120000
   3 D    2.000000
   4 F    3.000000

 Charge Fitting Sets (for the computation of the Coulomb Potential):  22
 -----------------------------------------------------------------------
   1 S   19.600000
   2 S   22.600000
   2 S   15.680000
   2 S   10.890000
   2 S    7.560000
   3 S    7.690000
   3 S    5.650000
   3 S    4.150000
   3 S    3.050000
   3 S    2.240000
   2 P   12.860000
   2 P    7.680000
   3 P    6.780000
   3 P    4.390000
   3 P    2.840000
   3 D    8.800000
   3 D    5.580000
   3 D    3.530000
   3 D    2.240000
   4 F    6.200000
   4 F    3.700000
   5 G    4.500000

 Atom Type    2  (H)
 ==============

 Valence Basis Sets:   5
 -----------------------
   1 S    0.690000
   1 S    0.920000
   1 S    1.580000
   2 P    1.250000
   3 D    2.500000

 Charge Fitting Sets (for the computation of the Coulomb Potential):  11
 -----------------------------------------------------------------------
   1 S    3.160000
   1 S    2.090000
   1 S    1.380000
   2 S    1.500000
   2 P    4.000000
   2 P    2.650000
   2 P    1.750000
   3 D    4.000000
   3 D    2.500000
   4 F    3.000000
   5 G    4.000000


 BAS: List of all Elementary Cartesian Basis Functions
 =====================================================

 The numbering in the list below (to the right of the function characteristics) is referred
 to in print-outs of MO eigenvectors and Mulliken populations in the BAS representation
 (as contrasted to the SFO representation).

 Notes:
 1. The functions are characterized by a polynomial prefactor (powers of x,y,z and r) and
    an exponential decay factor alpha.
 2. Since the basis sets are specific for an atom TYPE, the individual functions occur on
    all atoms of that type.
 3. The word 'Core' in the left margin signals that it is a Core Function (CF) : not a
    degree of freedom in the valence set, but only used to ensure orthogonalization of
    the other valence basis functions on the frozen Core Orbitals.


 (power of) X  Y  Z  R     Alpha  on Atom
            ==========     =====     ==========

 O                                    1
                                  ---------------------------------------------------------------------------
            0  0  0  0     9.800      1
            0  0  0  0     6.800      2
            0  0  0  1     7.580      3
            0  0  0  1     2.880      4
            0  0  0  1     1.720      5
            1  0  0  0     4.080      6
            0  1  0  0     4.080      7
            0  0  1  0     4.080      8
            1  0  0  0     2.080      9
            0  1  0  0     2.080     10
            0  0  1  0     2.080     11
            1  0  0  0     1.120     12
            0  1  0  0     1.120     13
            0  0  1  0     1.120     14
            2  0  0  0     2.000     15
            1  1  0  0     2.000     16
            1  0  1  0     2.000     17
            0  2  0  0     2.000     18
            0  1  1  0     2.000     19
            0  0  2  0     2.000     20
            3  0  0  0     3.000     21
            2  1  0  0     3.000     22
            2  0  1  0     3.000     23
            1  2  0  0     3.000     24
            1  1  1  0     3.000     25
            1  0  2  0     3.000     26
            0  3  0  0     3.000     27
            0  2  1  0     3.000     28
            0  1  2  0     3.000     29
            0  0  3  0     3.000     30

 H                                    2    3
                                  ---------------------------------------------------------------------------
            0  0  0  0     0.690     31   43
            0  0  0  0     0.920     32   44
            0  0  0  0     1.580     33   45
            1  0  0  0     1.250     34   46
            0  1  0  0     1.250     35   47
            0  0  1  0     1.250     36   48
            2  0  0  0     2.500     37   49
            1  1  0  0     2.500     38   50
            1  0  1  0     2.500     39   51
            0  2  0  0     2.500     40   52
            0  1  1  0     2.500     41   53
            0  0  2  0     2.500     42   54

 Total number of charge fitting functions (nprimf)       184
 Total number of Cartesian basis functions (naos)         54
 Total number of Cartesian core functions  (ncos)          0

 ***************************************************************************************************



                                              ***********************
                                              *  T E C H N I C A L  *
                                              ***********************
  



 =============================================================
 P A R A L L E L I Z A T I O N  and  V E C T O R I Z A T I O N
 =============================================================
  
 Nr of parallel processes:                                4
 Maximum vector length in NumInt loops:                 128



 =====================
 S C F   U P D A T E S
 =====================
  
 Max. nr. of cycles:                               300
 Convergence criterion:                              0.0000010000
   secondary criterion:                              0.0010000000

 Mix parameter (when DIIS does not apply):           0.2000000000
 Mixed ADIIS+SDIIS will be used                  
    Max number of expansion vectors:                10
    Pure ADIIS when Max([F,P]) is above              0.1000000000
    Pure SDIIS when Max([F,P]) is below              0.0010000000
 Automatic ElectronSmearing (in case of problematic SCF convergence) disabled



 =================
 P R E C I S I O N  ***  (General: NumInt, NeglectFunctionTails, ...)  ***
 =================
  

 NumInt:           Target precision:                 6.0000000000
 -------           Initial precision:                6.0000000000
                   Min. precision (optimization):    6.0000000000

 Neglect Functions:          Basis functions:        0.1000000000E-07
 ------------------          Fit functions:          0.1000000000E-07



 ===========================
 L I N E A R   S C A L I N G
 ===========================
  

 Cut-off radii density fit:                        0.1000000000E-09
 Overlap cut-off criterion AO matrix elements:     0.1000000000E-07
 Cut-offs for Coulomb potential and fitted density:0.1000000000E-09
 Cut-off criterion for Coulomb multipole terms:    0.1000000000E-09
 Progressive Convergence parameter:                 0.000000000    
 ***************************************************************************************************



                                            ***************************
                                            *  C O M P U T A T I O N  *
                                            ***************************
  

 Number of elements of the density matrix on this node (used, total):       465      1485



 ===========================================
 Numerical Integration : Fuzzy Cells (Becke)
 ===========================================
  
 Becke grid quality: GOOD           
  
 Lebedev angular grid order:             min:  11 max:  31
 Nr. of radial points:                   min:  54 max:  58

 Total nr. of points:      35918
 Nr. of blocks:              281
 Block length:               128
 Nr. of dummy points:         50


 Test of Precision of the Numerical Integration Grid
 ===================================================

 Integral of the Total Core Density:                   0.00000000000000



 ========================
 Density Fitting (zlmFit)
 ========================
  
 ZlmFit Fit Quality: GOOD           
  
 Max L-expansion:                        min:   8 max:   9
 Nr. of radial interpolation points:     min:  78 max: 108



 ======================
 RI Hartree-Fock Scheme
 ======================
  
 Fit Set Quality     : GOOD
 Threshold Quality   : GOOD
 Integration Quality : GOOD
 Fit Generation Method : AUTO
 Response Quality    : DEFAULT
 Is Range Separated  :  F
 
 RIHartreeFock Dependency: number of modified vectors: 1



 =====
 S C F  ***  ScaSCF  ***
 =====
  
 Initial density matrix is calculated as sum of fragments

 CYCLE    1
 SCF Error: norm([F,P])=      2.355667833869, max([F,P])=      1.410249109632
 orbitals (Q,E):
 ---------------
 A :1...15           ( 2.00   -19.5158)  ( 2.00    -1.2729)  ( 2.00    -0.6947)  ( 2.00    -0.5644)
                     ( 2.00    -0.4841)  ( 0.00    -0.0576)  ( 0.00     0.0211)  ( 0.00     0.1944)
                     ( 0.00     0.2028)  ( 0.00     0.2710)  ( 0.00     0.3217)  ( 0.00     0.4356)
                     ( 0.00     0.4660)  ( 0.00     0.5220)  ( 0.00     0.6367)

 CYCLE    2
  SDIIS (wt  0.000):  0.0958  0.9042
 A-DIIS (wt  1.000):  0.6917  0.3083
  DIIS coefficients:  0.6917  0.3083
 SCF Error: norm([F,P])=      0.732143412234, max([F,P])=      0.243240127716
 orbitals (Q,E):
 ---------------
 A :1...6            ( 2.00   -19.2753)  ( 2.00    -1.1463)  ( 2.00    -0.6018)  ( 2.00    -0.4582)
                     ( 2.00    -0.3770)  ( 0.00    -0.0295)

 CYCLE    3
  SDIIS (wt  0.000):  0.0002 -0.2892  1.2890
 A-DIIS (wt  1.000):  0.0000  0.0000  1.0000
  DIIS coefficients:  0.0000  0.0000  1.0000
 SCF Error: norm([F,P])=      0.178424987373, max([F,P])=      0.067417769211
 orbitals (Q,E):
 ---------------
 A :1...6            ( 2.00   -19.1066)  ( 2.00    -0.9996)  ( 2.00    -0.5130)  ( 2.00    -0.3642)
                     ( 2.00    -0.2858)  ( 0.00     0.0058)

 CYCLE    4
  SDIIS (wt  0.000):  0.2607  0.0554  0.6839
 A-DIIS (wt  1.000):  0.0000  0.6594  0.3406
  DIIS coefficients:  0.0000  0.6594  0.3406
 SCF Error: norm([F,P])=      0.293501695456, max([F,P])=      0.101601353037
 orbitals (Q,E):
 ---------------
 A :1...6            ( 2.00   -19.2146)  ( 2.00    -1.0397)  ( 2.00    -0.5447)  ( 2.00    -0.4045)
                     ( 2.00    -0.3272)  ( 0.00     0.0011)

 CYCLE    5
  SDIIS (wt  0.875):  0.0229  0.0285 -0.0626  1.0113
 A-DIIS (wt  0.125):  0.0000  0.0000  0.0000  1.0000
  DIIS coefficients:  0.0200  0.0249 -0.0548  1.0098
 SCF Error: norm([F,P])=      0.039602824381, max([F,P])=      0.013399003537
 orbitals (Q,E):
 ---------------
 A :1...6            ( 2.00   -19.2299)  ( 2.00    -1.0474)  ( 2.00    -0.5507)  ( 2.00    -0.4130)
                     ( 2.00    -0.3358)  ( 0.00     0.0003)

 CYCLE    6
  SDIIS (wt  0.986): -0.0015  0.0050  0.0067  0.0999  0.8899
 A-DIIS (wt  0.014):  0.0000  0.0000  0.0000  0.0000  1.0000
  DIIS coefficients: -0.0015  0.0050  0.0066  0.0985  0.8914
 SCF Error: norm([F,P])=      0.007001819154, max([F,P])=      0.002337775146
 orbitals (Q,E):
 ---------------
 A :1...6            ( 2.00   -19.2270)  ( 2.00    -1.0465)  ( 2.00    -0.5500)  ( 2.00    -0.4119)
                     ( 2.00    -0.3347)  ( 0.00     0.0004)

 CYCLE    7
  SDIIS (wt  1.000): -0.0008  0.0002  0.0038 -0.0165  0.1640  0.8492
  DIIS coefficients: -0.0008  0.0002  0.0038 -0.0165  0.1640  0.8492
 SCF Error: norm([F,P])=      0.000229376099, max([F,P])=      0.000096922585
 orbitals (Q,E):
 ---------------
 A :1...6            ( 2.00   -19.2270)  ( 2.00    -1.0465)  ( 2.00    -0.5499)  ( 2.00    -0.4119)
                     ( 2.00    -0.3347)  ( 0.00     0.0004)

 CYCLE    8
  SDIIS (wt  1.000):  0.0000 -0.0000 -0.0002  0.0002 -0.0100 -0.0515  1.0615
  DIIS coefficients:  0.0000 -0.0000 -0.0002  0.0002 -0.0100 -0.0515  1.0615
 SCF Error: norm([F,P])=      0.000008341041, max([F,P])=      0.000003124503
 orbitals (Q,E):
 ---------------
 A :1...6            ( 2.00   -19.2270)  ( 2.00    -1.0465)  ( 2.00    -0.5499)  ( 2.00    -0.4119)
                     ( 2.00    -0.3347)  ( 0.00     0.0004)

 CYCLE    9
  SDIIS (wt  1.000):  0.0000 -0.0000 -0.0000  0.0000 -0.0002 -0.0007 -0.0249  1.0258
  DIIS coefficients:  0.0000 -0.0000 -0.0000  0.0000 -0.0002 -0.0007 -0.0249  1.0258
 SCF Error: norm([F,P])=      0.000000509094, max([F,P])=      0.000000171579
 orbitals (Q,E):
 ---------------
 A :1...6            ( 2.00   -19.2270)  ( 2.00    -1.0465)  ( 2.00    -0.5499)  ( 2.00    -0.4119)
                     ( 2.00    -0.3347)  ( 0.00     0.0004)

 SCF CONVERGED

 CYCLE   10
 ***************************************************************************************************



                                                *******************
                                                *  R E S U L T S  *
                                                *******************
  
  
 Hartree-Fock exchange energy:  -8.92475992156433
 *** Using FIT density in Focky
  SDIIS (wt  1.000): -0.0000  0.0000  0.0000 -0.0000  0.0001  0.0001 -0.0026 -0.0393  1.0418
  DIIS coefficients: -0.0000  0.0000  0.0000 -0.0000  0.0001  0.0001 -0.0026 -0.0393  1.0418
 SCF Error: norm([F,P])=      0.000000033261, max([F,P])=      0.000000009394

 Orbital Energies, per Irrep and Spin:
 ======================================
                        Occup              E (au)              E (eV)       Diff (eV) with prev. cycle
                        -----      --------------------        ------       --------------------------
 A
               1        2.000     -0.19226990305933E+02      -523.193               1.25E-07
               2        2.000     -0.10464617313061E+01       -28.476               2.18E-07
               3        2.000     -0.54993684190739E+00       -14.965               2.18E-07
               4        2.000     -0.41188207868339E+00       -11.208              -1.74E-09
               5        2.000     -0.33473057824105E+00        -9.108               4.17E-08
               6        0.000      0.40164817596499E-03         0.011
               7        0.000      0.69219846148775E-01         1.884
               8        0.000      0.26925100165495E+00         7.327
               9        0.000      0.28279303441606E+00         7.695
              10        0.000      0.35522475373443E+00         9.666
              11        0.000      0.41714275381847E+00        11.351
              12        0.000      0.50369726278064E+00        13.706
              13        0.000      0.55878442094433E+00        15.205
              14        0.000      0.59198433116901E+00        16.109
              15        0.000      0.71540706814954E+00        19.467
  
 HOMO :        5 A                -0.33473057824105E+00
 LUMO :        6 A                 0.40164817596499E-03
  


 All Electron Calculation, thus no Orbital Energies of the Core Orbitals are calculated


 Fit test: (difference of exact and fit density, squared integrated, result summed over spins)
         Sum-of-Fragments:                             0.00000000052535
         Orthogonalized Fragments:                     0.00000117185747
         SCF:                                          0.00000554634519



 ==========================
 Electron Density at Nuclei
 ==========================
  
 The electron density is calculated at points on a small sphere around the center of a nucleus.
 The printed electron density is the average electron density on these points.
 The radius of the sphere is the printed approximate finite nuclear radius.
 Note: density is calculated in the Dirac picture

         Atom        Nuclear Radius (Angstrom)             Electron Density (a.u.)
         ----        -------------------------             -----------------------
     1)   O                 0.0000345546                              312.39587
     2)   H                 0.0000181514                                0.47601
     3)   H                 0.0000181514                                0.47601



 =======================================
 M U L L I K E N   P O P U L A T I O N S
 =======================================
  
 The survey below gives for each atom:
 a) the total charge (Z minus electrons)
 b) the net spin polarization (nr of electrons spin-A minus spin-B)
 c) for each spin the atomic electron valence density (integrated) per L-value.

 Atom              Charge    Spin density          S         P         D         F
 ----              ------    ------------       ------    ------    ------    ------
 1 O              -0.5372                       3.7846    4.7127    0.0361    0.0037
 2 H               0.2686                       0.6076    0.1124    0.0115    0.0000
 3 H               0.2686                       0.6076    0.1124    0.0115    0.0000

 Populations of individual BAS functions
 ----------------------------------------
 1 O            0.6762  1.2802  0.0146  1.0030  0.8106  0.3203  0.2640  0.2253  1.0278  0.9083
                0.8704  0.5291  0.4473  0.1201 -0.0182  0.0032 -0.0000  0.0045  0.0224  0.0243
               -0.0103 -0.0101 -0.0089  0.0037 -0.0000  0.0069 -0.0010  0.0054  0.0134  0.0046
 2 H           -0.0441  0.2711  0.3806  0.0550  0.0467  0.0106 -0.0058  0.0017  0.0030  0.0034
                0.0028  0.0063
 3 H           -0.0441  0.2711  0.3806  0.0550  0.0467  0.0106 -0.0058  0.0017  0.0030  0.0034
                0.0028  0.0063

 Gross Charges per Atom (Z minus electrons)
 ==========================================
            -0.5372    0.2686    0.2686
 Net Total: -0.00000000


 Atom-Atom Population Matrix (off-diagonal elements not doubled)
 ===============================================================

     1 :     7.7419
     2 :     0.3976    0.4135
     3 :     0.3977   -0.0798    0.4135



 =================================================
 H I R S H F E L D   C H A R G E   A N A L Y S I S
 =================================================
  
 For each fragment: the (numerical) integral of rho(scf) * rho(fragment)/rho(sum-of-fragments)
 (nuclear charges are included, electrons are counted negative)

 The fragments and their ordering are defined in the early G E O M E T R Y output section.
 If you use single-atom fragments, this usually implies that all atoms of the same
 chemical type are grouped together. This may not be the order in which you listed them
 in the input file!

  Fragment                       Charge
 ------------------------------------------
    1  O                        -0.3131
    2  H                         0.1566
    3  H                         0.1566

 Sum of these charges =          0.00000509
 (accuracy NumInt/Tails)



 =============================
 V O R O N O I   C H A R G E S
 =============================
  
 For each atom: the (numerical) integral of the total electronic charge density in its Voronoi cell,
 i.e. the region of space that is closer to that atom than to any other atom.
 (cf. Wigner-Seitz cells in crystals)

 Within the Voronoi cell the subintegrals over the atomic sphere and the remaining part are evaluated
 separately to give the numbers of electrons (negative charge) in these regions.
 The net total charge in the cell (including the nuclear charge) is also given.

 Values are provided for
    a) the Initial (sum-of-fragments) density
    b) the Orthogonalized-Fragments density
    c) the SCF density
    d) the Voronoi Deformation Density (VDD): the difference SCF-Initial for the complete atomic cell

  Atom                Initial                    OrthFrag                   SCF
             Sphere RestCell NetTotal   Sphere RestCell NetTotal   Sphere RestCell NetTotal      VDD
 -------     ------------------------   ------------------------   ------------------------    -----
    1 O      -2.799   -4.206    0.995   -2.935   -4.275    0.789   -2.825   -4.453    0.722   -0.273
    2 H      -0.095   -1.415   -0.511   -0.096   -1.308   -0.404   -0.127   -1.245   -0.372    0.139
    3 H      -0.095   -1.389   -0.484   -0.096   -1.290   -0.386   -0.127   -1.223   -0.350    0.135
 ---------------------------------------------------------------------------------------------------
 Total NetCharge:               0.000                      0.000                      0.000    0.000
 (accuracy NumInt/Tails)

 Remark: the 'NetTotal' Voronoi charges often do not match the Mulliken and/or Hirshfeld charges very
 well. This is caused by the fact that chemically different atoms are not treated in accordance with
 their relative sizes. (Voronoi cells are defined by boundary planes halfway between the atoms.)
 However, the CHANGES in charge, comparing 'Initial' to 'SCF' for instance, do give a fair indication
 of the flow of charge caused by the relaxation from sum-of-fragments to self-consistency.

 Warning: the absolute accuracy of the VDD charges obtained using the Fuzzy Cells (Becke) integration
 scheme is much poorer than the one obtained with an 'equivalent' Voronoi integration grid. 



 =================================================================
 M U L T I P O L E   D E R I V E D   C H A R G E   A N A L Y S I S
 =================================================================

 This charge analysis uses the atomic multipoles (obtained from the fitted density) up to some level X,
 and reconstructs these multipoles exactly (up to level X) by distributing charges over all atoms.
 This is achieved by using Lagrange multipliers and a weight function to keep the multipoles local.

 Dummy atoms can be included (by setting INCDUM in MDC-block to 1) to obtain a fractional charge.
 This is generally useful and necessary only for small symmetrical molecules, when there are not
 enough degrees of freedom to reconstruct the multipoles.

 Since the atomic multipoles are reconstructed up to level X,
 the molecular multipoles are represented also up to level X.
 The recommended level is to reconstruct up to quadrupole : -> MDC-q charges.

 See: M. Swart, P.Th. van Duijnen, J.G. Snijders, J.Comput.Chem., (2001), p. 79-88.

 ------------------------------------------------------------- 
 Atomic electronic multipole moments from SCF equations (a.u.)
 ------------------------------------------------------------- 

   atom        charge        dip-x     dip-y     dip-z      quad-xx   quad-xy   quad-xz   quad-yy   quad-yz   quad-zz
 --------------------------------------------------------------------------------------------------------------------
    1 O     -0.189609    -0.000000  0.428757 -0.000000    -0.938450  0.000000 -0.000000  0.084525  0.000000  0.853925
    2 H      0.094805     0.000000  0.042975  0.088593    -0.152953 -0.000000  0.000000  0.018342  0.063573  0.134611
    3 H      0.094805     0.000000  0.042975 -0.088593    -0.152953 -0.000000 -0.000000  0.018342 -0.063573  0.134611

 --------------------------------------- 
 Multipole derived atomic charges (a.u.)
 --------------------------------------- 

 The MDC-m charges are just the Monopole terms in the multipole expansion, while for the MDC-d charges
 also the Dipoles are reconstructed. The usually preferred charges are the MDC-q charges.
 These reconstruct the Monopoles, Dipoles and Quadrupoles (both atomic AND molecular).

        Atom    Level:     MDC-m        MDC-d        MDC-q
 ---------------------------------------------------------
     1     O           -0.189609    -0.649955    -0.705026
     2     H            0.094805     0.324977     0.352513
     3     H            0.094805     0.324977     0.352513

 ------------------------------------------------ 
 Average absolute deviations in atomic multipoles
 ------------------------------------------------ 

 Stated here are the average differences between the atomic multipoles
 and the reconstructed atomic multipoles (from the distributed charges).
 If these values are not zero, this means there are not enough degrees of freedom,
 to be able to reconstruct the atomic multipoles. (This usually happens only
 for small and/or highly symmetric molecules). If this is the case, one could add
 dummy atoms as extra point charges (and setting INCDUM in MDC-block to 1).

 Level:                                 MDC-d        MDC-q
 ---------------------------------------------------------
 Charge   (a.u.)                       0.0000       0.0000
 Dipole   (Debye)                      0.0000       0.1563
 Quad.    (a.u.)                       0.1111       0.0300

 --------------------------------------- 
 Represented molecular multipole moments
 --------------------------------------- 

 Given here are the Molecular multipole moments from the atomic charges, and from the Fit Density.
 Note that the atomic charges represent the latter, NOT the ones from the Exact density.

            Q (a.u.)             Dipole moment (Debye)                                          Quadrupole moment (a.u.)
                                 x         y         z              xx        xy        xz        yy        yz        zz
------------------------------------------------------------------------------------------------------------------------
MDC-m        -0.0000        0.0000    0.5389   -0.0000         -0.4227    0.0000    0.0000    0.2600   -0.0000    0.1626
MDC-d        -0.0000        0.0000    1.8471   -0.0000         -1.4489    0.0000    0.0000    0.8914   -0.0000    0.5575
MDC-q        -0.0000        0.0000    2.0036    0.0000         -1.5717    0.0000    0.0000    0.9669    0.0000    0.6047
 
Fit.Dens.    -0.0000        0.0000    1.8471   -0.0000         -2.2821    0.0000   -0.0000    0.8488   -0.0000    1.4333



 =============
 Dipole Moment  ***  (Debye)  ***
 =============
  
 Vector   :         0.00000000      1.84727239     -0.00000012
 Magnitude:         1.84727239

 This molecular dipole moment is calculated with analytic integration



 =========================================
 Quadrupole Moment (Buckingham convention)  ***  (a.u.)  ***
 =========================================
  
      quad-xx        quad-xy        quad-xz        quad-yy        quad-yz        quad-zz
     -2.28227487     0.00000000    -0.00000000     0.84890493    -0.00000017     1.43336993

 This molecular quadrupole moment is calculated with analytic integration



 ===========================
 B O N D I N G   E N E R G Y  ***  (decomposition)  ***
 ===========================
  
*** IMPORTANT NOTE ***

The bond energy is computed as an energy difference between molecule and
fragments. In particular when the fragments are single atoms, they are usually
computed as SPHERICALLY SYMMETRIC and SPIN-RESTRICTED. Obviously, this usually
does NOT represent the true atomic groundstate.

To obtain the 'real' bond energy, (atomic) correction terms must be applied
for the true (multiplet) fragment ground state. See ref: E.J.Baerends,
V.Branchadell, M.Sodupe, Chem.Phys.Lett.265 (1997) 481

General theoretical background on the bond energy decomposition scheme used
here (Morokuma-Ziegler) can be found in the review paper:
F.M. Bickelhaupt and E.J. Baerends,
"Kohn-Sham Density Functional Theory: Predicting and Understanding Chemistry"
In: Rev. Comput. Chem.; Lipkowitz, K. B. and Boyd, D. B., Eds.;
Wiley-VCH: New York, 2000, Vol. 15, 1-86.

Symbols used in the Bickelhaupt-Baerends (BB) paper are given below to make
the direct connection to that paper, where detailed explanations can be found
on the meaning of the various terms.


                                                   hartree              eV         kcal/mol           kJ/mol
                                      --------------------     -----------       ----------      -----------
  pauli hf:                              0.091933729633731          2.5016            57.69           241.37
  elstat hf:                            -0.172189058877811         -4.6855          -108.05          -452.08

Pauli Repulsion
  Kinetic (Delta T^0):                   3.733048109847047        101.5814          2342.52          9801.12
  Delta V^Pauli Coulomb:                -1.984826268022165        -54.0099         -1245.50         -5211.16
  Delta V^Pauli Hybrid-X:               -0.308778440541843         -8.4023          -193.76          -810.70
  Delta V^Pauli Hybrid-C:               -0.028616604571987         -0.7787           -17.96           -75.13
  Delta V^Pauli HF-Exchange:            -0.080255329244080         -2.1839           -50.36          -210.71
                                      --------------------     -----------       ----------      -----------
  Total Pauli Repulsion:                 1.330571467466972         36.2067           834.95          3493.41
 (Total Pauli Repulsion =
  Delta E^Pauli in BB paper)

Steric Interaction
  Pauli Repulsion (Delta E^Pauli):       1.330571467466972         36.2067           834.95          3493.41
  Electrostatic Interaction:            -0.249614093471269         -6.7923          -156.64          -655.36
 (Electrostatic Interaction =
  Delta V_elstat in the BB paper)
                                      --------------------     -----------       ----------      -----------
  Total Steric Interaction:              1.080957373995703         29.4143           678.31          2838.05
 (Total Steric Interaction =
  Delta E^0 in the BB paper)

Orbital Interactions
  A:                                    -1.751176291567445        -47.6519         -1098.88         -4597.71
  HF orbital correction:                -0.000037523418237         -0.0010            -0.02            -0.10
                                      --------------------     -----------       ----------      -----------
  Total Orbital Interactions:           -1.751213814985682        -47.6530         -1098.90         -4597.81

Alternative Decomposition Orb.Int.
  Kinetic:                              -3.119378706429146        -84.8826         -1957.44         -8189.93
  Coulomb:                               1.595212878561190         43.4080          1001.01          4188.23
  XC+HF:                                -0.227047987117726         -6.1783          -142.47          -596.11
  XC only:                              -0.049175350462437         -1.3381           -30.86          -129.11
  HF Orbital:                           -0.177872636655290         -4.8402          -111.62          -467.00
                                      --------------------     -----------       ----------      -----------
  Total Orbital Interactions:           -1.751213814985682        -47.6530         -1098.90         -4597.81

  Residu (E=Steric+OrbInt+Res):         -0.000000399823940         -0.0000            -0.00            -0.00
  Dispersion Energy:                    -0.000276876780756         -0.0075            -0.17            -0.73

Total Bonding Energy:                   -0.670533717594675        -18.2462          -420.77         -1760.49


Summary of Bonding Energy (energy terms are taken from the energy decomposition above)
======================================================================================

  Electrostatic Energy:                 -0.249614093471269         -6.7923          -156.64          -655.36
  Kinetic Energy:                        0.613669403417901         16.6988           385.08          1611.19
  Coulomb (Steric+OrbInt) Energy:       -0.389613789284915        -10.6019          -244.49         -1022.93
  XC Energy:                            -0.644698361475636        -17.5431          -404.55         -1692.66
  Dispersion Energy:                    -0.000276876780756         -0.0075            -0.17            -0.73
                                      --------------------     -----------       ----------      -----------
  Total Bonding Energy:                 -0.670533717594675        -18.2462          -420.77         -1760.49


Correction terms (incorporated in energies above; only for test purposes):

1. Indication of fit-quality: 1st-order fit-correction used in the energy (hartree):   0.0000143053
2. Electrostatic (Fit correction):   0.0000000000



 =======================================================
 S F O   P O P U L A T I O N S ,   M O   A N A L Y S I S
 =======================================================
  
 A Mulliken population analysis is performed on (input-)selected MOs. All populations refer to SFOs.
 BAS populations may have been printed directly after the SCF part.


                                       === A ===


 SFO contributions (%) per orbital
 (multiplication by the orbital occupation yields the SFO Gross Populations)

 Orb.:        1      2      3      4      5      6      7      8      9
 occup:     2.00   2.00   2.00   2.00   2.00   0.00   0.00   0.00   0.00
 CF+SFO     ----   ----   ----   ----   ----   ----   ----   ----   ----
 ------
      1:  100.04   0.00  -0.00   0.00  -0.00   0.00  -0.00  -0.01  -0.00
      2:    0.00  78.72   0.00  10.72   0.00   0.16  -0.00   9.55  -0.00
      3:   -0.00  -0.00  -0.00  -0.26  -0.00   3.93  -0.00 -16.53   0.00
      6:    0.00   0.00   0.00   0.00  93.79   0.00   0.00  -0.00  -0.00
      9:    0.00   3.63  -0.00  77.33  -0.00   0.64   0.00  13.95   0.00
     10:   -0.00  -0.03   0.00   0.04  -0.00   3.70   0.00  -7.40   0.00
     12:   -0.00  -0.00  61.89   0.00   0.00   0.00   5.67   0.00  29.62
     13:   -0.00  -0.00  -1.00  -0.00  -0.00  -0.00 -19.21  -0.00  -3.51
     19:   -0.00  -0.00   1.12  -0.00  -0.00  -0.00  -0.18   0.00  -1.49
     27:   -0.02   7.40  15.65   3.20   0.00  11.84  39.90  28.08  15.11
     28:   -0.00   0.21   2.53   0.97   0.00  28.78  14.29  22.05  21.98
     29:   -0.00  -0.50   0.57   0.37  -0.00   0.06   2.82   1.72  -1.92
     30:    0.00  -0.00  -0.00   0.00   2.75   0.00   0.00   0.00   0.00
     31:   -0.00   0.40   0.83   1.10  -0.00   1.99  -0.03  -0.11   3.09
     32:   -0.00   1.04  -0.65   0.15  -0.00   2.83  -0.37   0.22   0.02
     38:   -0.02   7.40  15.65   3.20   0.00  11.84  39.90  28.08  15.11
     39:   -0.00   0.21   2.53   0.97   0.00  28.78  14.29  22.05  21.98
     40:   -0.00  -0.50   0.57   0.37  -0.00   0.06   2.82   1.72  -1.92
     41:   -0.00  -0.00   0.00  -0.00   2.75  -0.00   0.00   0.00   0.00
     42:   -0.00   0.40   0.83   1.10  -0.00   1.99  -0.03  -0.11   3.09
     43:   -0.00   1.04  -0.65   0.15  -0.00   2.83  -0.37   0.22   0.02


 Summation over all MOs, multiplied by occupation: Total SFO Gross Populations in this Irrep
 ===========================================================================================

     2.00    1.79   -0.01   -0.00    0.00    1.88    0.00    0.00    1.62    0.00    0.00    1.24
    -0.02   -0.00    0.00    0.01    0.00   -0.00    0.02    0.00    0.00   -0.00    0.00    0.00
     0.00    0.00    0.52    0.07    0.01    0.05    0.05    0.01    0.00    0.00    0.00    0.00
     0.00    0.52    0.07    0.01    0.05    0.05    0.01    0.00    0.00    0.00    0.00    0.00



 List of selected MOs, ordered by energy, with the most significant SFO gross populations
 ========================================================================================

 Each percentage contribution in the table below corres ponds to the indicated SFO.
 In general, a SFO may be a linear combination of several Fragment Orbitals on the same,
 or on symmetry-related Fragments. Only the first 'member' of such a combination is
 specified here. A full definition of all SFOs is given in an earlier part of the output.
 The numbering of the SFOs in this table does NOT include the Core Orbitals, and starts
 from one for each symmetry representation, as in the SFO definition list earlier.

       E(eV)  Occ       MO           %     SFO (first member)   E(eV)  Occ   Fragment
 -------------------------------------------------------------------------------------

     -14.965  2.00     3 A         61.89%     1 P:z            -9.955  1.33     1 O
                                   15.65%     1 S              -6.582  1.00     2 H
                                   15.65%     1 S              -6.582  1.00     3 H
                                    2.53%     2 S               3.073  0.00     2 H
                                    2.53%     2 S               3.073  0.00     3 H
                                    1.12%     1 D:yz           30.706  0.00     1 O
     -11.208  2.00     4 A         77.33%     1 P:y            -9.955  1.33     1 O
                                   10.72%     2 S             -27.197  2.00     1 O
                                    3.20%     1 S              -6.582  1.00     2 H
                                    3.20%     1 S              -6.582  1.00     3 H
                                    1.10%     1 P:y            12.103  0.00     3 H
                                    1.10%     1 P:y            12.103  0.00     2 H
      -9.108  2.00     5 A         93.79%     1 P:x            -9.955  1.33     1 O
                                    2.75%     1 P:x            12.103  0.00     3 H
                                    2.75%     1 P:x            12.103  0.00     2 H
       0.011  0.00     6 A         28.78%     2 S               3.073  0.00     2 H
                                   28.78%     2 S               3.073  0.00     3 H
                                   11.84%     1 S              -6.582  1.00     2 H
                                   11.84%     1 S              -6.582  1.00     3 H
                                    3.93%     3 S              23.286  0.00     1 O
                                    3.70%     2 P:y            10.811  0.00     1 O
                                    2.83%     1 P:z            12.103  0.00     3 H
                                    2.83%     1 P:z            12.103  0.00     2 H
                                    1.99%     1 P:y            12.103  0.00     3 H
                                    1.99%     1 P:y            12.103  0.00     2 H
       1.884  0.00     7 A         39.90%     1 S              -6.582  1.00     3 H
                                   39.90%     1 S              -6.582  1.00     2 H
                                  -19.21%     2 P:z            10.811  0.00     1 O
                                   14.29%     2 S               3.073  0.00     3 H
                                   14.29%     2 S               3.073  0.00     2 H
                                    5.67%     1 P:z            -9.955  1.33     1 O
                                    2.82%     3 S              43.500  0.00     2 H
                                    2.82%     3 S              43.500  0.00     3 H



 =======================================================================
 Electrostatic potential at the Nuclei due to electrons and other nuclei
 =======================================================================
  
         Atom                  Potential
         ----                  ---------
     1)   O                  22.38582793
     2)   H                   0.99855426
     3)   H                   0.99855427
 Mulliken charges used for AMS results%charges...


    =====================
     CALCULATION RESULTS
    =====================

Energy (hartree)            -0.67053372


--------------
Atomic charges
--------------
  Index   Atom    Charge
      1      O   -0.5372
      2      H    0.2686
      3      H    0.2686


Dipole moment vector    (Debye):     0.00000000    1.84727239   -0.00000012
              magnitude (Debye):     1.84727239


-----------------------
Molecular orbitals info
-----------------------
n orbitals:               48
n spin:                    1

Note: only printing virtual orbitals with
      energy smaller than HOMO + 100. eV

HOMO (eV):              -9.1085
LUMO (eV):               0.0109
HOMO-LUMO gap (eV):      9.1194

   Index   Energy (eV)    Occupation
      30       86.0659         0.000       
      29       85.4627         0.000       
      28       74.4596         0.000       
      27       70.9839         0.000       
      26       68.6401         0.000       
      25       61.1245         0.000       
      24       60.8861         0.000       
      23       51.1320         0.000       
      22       46.9488         0.000       
      21       45.2997         0.000       
      20       44.6673         0.000       
      19       35.0690         0.000       
      18       34.4247         0.000       
      17       29.8991         0.000       
      16       23.2816         0.000       
      15       19.4672         0.000       
      14       16.1087         0.000       
      13       15.2053         0.000       
      12       13.7063         0.000       
      11       11.3510         0.000       
      10        9.6662         0.000       
       9        7.6952         0.000       
       8        7.3267         0.000       
       7        1.8836         0.000       
       6        0.0109         0.000 < LUMO
       5       -9.1085         2.000 < HOMO
       4      -11.2079         2.000       
       3      -14.9645         2.000       
       2      -28.4757         2.000       
       1     -523.1930         2.000       

AMS application finished. Exiting.
NORMAL TERMINATION
     Total cpu time:      13.64
  Total system time:       1.00
 Total elapsed time:      19.49
